{
  "$schema": "https://json-schema.org/draft/2020-12/schema",
  "$id": "https://vineyard.run/schemas/registry/plugin-entry/1.0.0.json",
  "title": "Vineyard registry plugin entry",
  "description": "One row in community-pluginpacks.json. LEAN catalog projection: the full manifest lives in the author repo at repo@ref/path; derived fields let the browse page render without fetching every manifest.",
  "type": "object",
  "additionalProperties": false,
  "required": [
    "identifier",
    "content_type",
    "name",
    "author",
    "description",
    "repo",
    "ref",
    "path"
  ],
  "properties": {
    "identifier": {
      "type": "string",
      "pattern": "^(?:[a-z0-9]+(?:-[a-z0-9]+)*\\.){2,}(?:plugins|pluginpacks)\\.[a-z0-9_]+$",
      "description": "Reverse-DNS PK; equals manifest.identifier. `plugins.*` = a single plugin, `pluginpacks.*` = a bundle (one file → many plugins). Unique across the whole registry. The namespace is the AUTHOR'S OWN reverse-DNS prefix, two labels or more: `run.vineyard.*` is first-party, a third party publishes under its own (`com.acme.*`, `io.github.someone.*`). Claiming a namespace you do not control is a review question, not a schema one."
    },
    "content_type": {
      "enum": [
        "vineyard:plugin",
        "vineyard:pluginpack"
      ]
    },
    "name": {
      "type": "string",
      "minLength": 1,
      "maxLength": 128
    },
    "author": {
      "type": "string",
      "minLength": 1,
      "description": "Author handle; matched against verified-authors.json."
    },
    "description": {
      "type": "string",
      "minLength": 1,
      "maxLength": 250,
      "description": "<=250 chars, sentence case, ends with a period, no emoji."
    },
    "repo": {
      "type": "string",
      "pattern": "^[^/]+/[^/]+$",
      "description": "owner/name GitHub path; the only pointer to code."
    },
    "ref": {
      "type": "string",
      "pattern": "^([0-9a-f]{40}|[0-9a-f]{64})$",
      "description": "IMMUTABLE commit SHA (40-hex SHA-1 or 64-hex SHA-256) of the content repo, captured at PR time. Tags/branches are mutable (re-pointable to other code) and are REJECTED - pin the exact reviewed commit so the catalog can never serve different code. Human-readable release is in `version`."
    },
    "path": {
      "type": "string",
      "description": "Path to manifest.json within repo@ref."
    },
    "version": {
      "type": "string",
      "pattern": "^\\d+\\.\\d+\\.\\d+(?:[-+].+)?$",
      "description": "SemVer mirror of manifest.version at this ref."
    },
    "platforms": {
      "type": "array",
      "uniqueItems": true,
      "items": {
        "enum": [
          "web",
          "web-proxy",
          "desktop"
        ]
      },
      "description": "DERIVED badge set from platforms.{web,desktop} + web.runtime."
    },
    "scopes_summary": {
      "type": "object",
      "additionalProperties": false,
      "description": "DERIVED neutral facets for filtering (NOT warnings). No special 'destructive' treatment by product decision.",
      "properties": {
        "network": {
          "type": "boolean",
          "description": "true if scopes.network is non-empty OR the plugin declares web_probe - the probe reaches an arbitrary host, so it is the broader egress, not a lesser one. NOT set by scopes.services, which is its own field: a service call goes to a destination the host fixes, carrying the analyst's identity."
        },
        "graph_write": {
          "type": "boolean",
          "description": "true if any node:/edge: create/update/delete verb is present."
        },
        "secret_config": {
          "type": "boolean",
          "description": "true if any scopes.config has secret:true (=> desktop-only key)."
        }
      }
    },
    "services": {
      "type": "array",
      "uniqueItems": true,
      "items": { "enum": ["rdap", "telegram"] },
      "description": "DERIVED: the union of every member's `scopes.services`. Its own field rather than a flag folded into scopes_summary.network, because it is a different statement: the destination is a Vineyard service the host addresses (a pack cannot name one), and the analyst's own identity travels with the call. A card that showed only 'Network' would understate the second half and overstate the first."
    },
    "plugin_count": {
      "type": "integer",
      "minimum": 1,
      "description": "DERIVED: number of plugins bundled when the identifier names a PACK (one file → many plugins, §3.4). Omitted (or 1) for a single-plugin entry. The marketplace shows the pack as one card and installs all contained plugins together."
    },
    "desktop_only": {
      "enum": ["all", "some"],
      "description": "DERIVED: `all` when every member's platforms.primary is `desktop`, `some` when at least one but not all are. Omitted when none are."
    },
    "icon": {
      "type": "string",
      "pattern": "^[a-z][a-z0-9]*(?:-[a-z0-9]+)*$",
      "description": "DERIVED: the manifest's top-level `icon` when it is a kebab-case lucide icon name. Omitted otherwise."
    },
    "typepacks": {
      "type": "array",
      "uniqueItems": true,
      "items": {
        "type": "string",
        "pattern": "^(?:[a-z0-9]+(?:-[a-z0-9]+)*\\.){2,}typepacks\\.[a-z0-9]+(?:[._-][a-z0-9]+)*$"
      },
      "description": "Typepack identifiers the pack's plugins consume/produce (io.consumes/io.produces). The marketplace offers these for co-install the same way a skillpack's requires offers pluginpacks; a plugin that writes a type from a pack the project never installed fails at node-create time."
    },
    "thumbnail_url": {
      "type": "string",
      "format": "uri"
    },
    "verified": {
      "type": "boolean",
      "default": false,
      "description": "DERIVED: set by build_registry.py from verified-authors.json — true when the identifier's namespace is claimed by the handle in `author`. Never read from the submission; a value typed here is discarded."
    },
    "status": {
      "type": "object",
      "additionalProperties": false,
      "required": ["state", "reason", "since"],
      "properties": {
        "state": {
          "enum": ["deprecated", "withdrawn"],
          "description": "`deprecated`: still safe, still loads, no longer recommended — the analyst is told and may keep using it. `withdrawn`: must not run — clients refuse to load it even where it is already installed, and it can no longer be installed. Withdrawal is for a pack that turned out to be harmful or whose content is gone; it is not a way to retire something."
        },
        "reason": {
          "type": "string",
          "minLength": 10,
          "maxLength": 300,
          "description": "Shown verbatim to an analyst who has this pack installed. Write it for them, not for the registry: what happened and what to do."
        },
        "since": { "type": "string", "pattern": "^\\d{4}-\\d{2}-\\d{2}$", "description": "Date of the delisting, YYYY-MM-DD." },
        "replacement": {
          "type": "string",
          "pattern": "^(?:[a-z0-9]+(?:-[a-z0-9]+)*\\.){2,}(?:plugins|pluginpacks)\\.[a-z0-9_]+$",
          "description": "Where users should go instead. Must be a live pack of the same kind in this catalog."
        }
      },
      "description": "Present only on a DELISTED entry. The row stays in the catalog on purpose — deleting it takes the pack off the browse page but tells an already-installed client nothing, which is the one audience that needs to hear. See SPEC.md §7."
    }
  }
}
