{
  "identifier": "run.vineyard.pluginpacks.ip_classification",
  "content_type": "vineyard:pluginpack",
  "name": "IP Classification (under testing)",
  "author": "VINEYARD",
  "description": "Classifies IP addresses as scanners, C2 and malware families, crawlers, anonymizers and non-routable space.",
  "repo": "Vineyard-Intelligence/pluginpack-ip-classification",
  "ref": "987bfd0a87f8923b96bfad5aed1a38797ae18103",
  "path": "plugins/ip-classification.manifest.json",
  "version": "4.0.0",
  "platforms": [
    "web"
  ],
  "scopes_summary": {
    "network": true,
    "graph_write": true,
    "secret_config": false
  },
  "plugin_count": 1,
  "icon": "fingerprint",
  "typepacks": [
    "run.vineyard.typepacks.infrastructure",
    "run.vineyard.typepacks.threat"
  ]
}
