{
  "identifier": "run.vineyard.pluginpacks.disposable_email",
  "content_type": "vineyard:pluginpack",
  "name": "Disposable Email",
  "author": "VINEYARD",
  "description": "Checks email addresses against the disposable/disposable-email-domains blocklist (CC0).",
  "repo": "Vineyard-Intelligence/pluginpack-disposable-email",
  "ref": "2d41b6a67a18a6664df5bd76fde1fba62eb5b0c8",
  "path": "plugins/disposable-email.manifest.json",
  "version": "1.1.2",
  "platforms": [
    "web",
    "desktop"
  ],
  "scopes_summary": {
    "network": true,
    "graph_write": true,
    "secret_config": false
  },
  "plugin_count": 1,
  "icon": "mail-x",
  "typepacks": [
    "run.vineyard.typepacks.identity"
  ]
}
