{
  "identifier": "run.vineyard.pluginpacks.google_docs_metadata",
  "content_type": "vineyard:pluginpack",
  "name": "Google Docs Metadata",
  "author": "VINEYARD",
  "description": "Reads the public metadata of link-shared Google Docs/Drive files: owner, email, timestamps and sharing role. Desktop only. A port of xeuledoc by Malfrats Industries (https://github.com/Malfrats/xeuledoc), licensed GPL-3.0.",
  "repo": "Vineyard-Intelligence/pluginpack-google-docs-metadata",
  "ref": "2813c1ed0fc1171e5913e228e4033e4870e01ae4",
  "path": "plugins/google-docs-metadata.manifest.json",
  "version": "2.1.1",
  "platforms": [
    "desktop",
    "web"
  ],
  "scopes_summary": {
    "network": true,
    "graph_write": true,
    "secret_config": false
  },
  "plugin_count": 1,
  "icon": "file-search",
  "desktop_only": "all",
  "typepacks": [
    "run.vineyard.typepacks.identity",
    "run.vineyard.typepacks.infrastructure"
  ]
}
