{
  "identifier": "run.vineyard.pluginpacks.censys",
  "content_type": "vineyard:pluginpack",
  "name": "Censys (under test)",
  "author": "VINEYARD",
  "description": "Censys lookups with your own token: certificates, SSH host keys and services an IP presents; hosts sharing a certificate or key; CenQL searches. Desktop only. Registered by the VINEYARD operator for academic research. It may be removed in the future.",
  "repo": "Vineyard-Intelligence/pluginpack-censys",
  "ref": "2bd2a244126eb343fdba20d354bad0d3f54d7f46",
  "path": "plugins/censys.manifest.json",
  "version": "0.3.4",
  "platforms": [
    "desktop",
    "web"
  ],
  "scopes_summary": {
    "network": true,
    "graph_write": true,
    "secret_config": true
  },
  "plugin_count": 2,
  "icon": "scan-line",
  "desktop_only": "all",
  "typepacks": [
    "run.vineyard.typepacks.infrastructure"
  ]
}
