{
  "identifier": "run.vineyard.pluginpacks.github",
  "content_type": "vineyard:pluginpack",
  "name": "GitHub",
  "author": "VINEYARD",
  "description": "Collects public GitHub data: repositories, commit identities, gists, organisation members, activity hours, worked-on forks, Pages domains, GPG keys and code search. Token: fine-grained (Public repositories, no permissions) or classic with no scopes.",
  "repo": "Vineyard-Intelligence/pluginpack-github",
  "ref": "c37b8d015a5d03f380e2f86e32f11bac8e20282a",
  "path": "plugins/github.manifest.json",
  "version": "1.4.0",
  "platforms": [
    "web",
    "desktop"
  ],
  "scopes_summary": {
    "network": true,
    "graph_write": true,
    "secret_config": true
  },
  "plugin_count": 9,
  "icon": "github",
  "desktop_only": "some",
  "typepacks": [
    "run.vineyard.typepacks.identity",
    "run.vineyard.typepacks.infrastructure"
  ]
}
