{
  "identifier": "run.vineyard.pluginpacks.telegram",
  "content_type": "vineyard:pluginpack",
  "name": "Telegram",
  "author": "VINEYARD",
  "description": "Read-only Telegram collection without joining: keyword search, handle resolution, invite-link analysis, posts, participants and phone-number lookup, written as telegram.* nodes. Runs through Vineyard's Telegram service.",
  "repo": "Vineyard-Intelligence/pluginpack-telegram",
  "ref": "cb1c04653f4b4efad0f3c8ba19677aa3c9afce9e",
  "path": "plugins/telegram.manifest.json",
  "version": "2.4.4",
  "platforms": [
    "web"
  ],
  "scopes_summary": {
    "network": false,
    "graph_write": true,
    "secret_config": false
  },
  "plugin_count": 6,
  "icon": "send",
  "typepacks": [
    "run.vineyard.typepacks.identity",
    "run.vineyard.typepacks.infrastructure",
    "run.vineyard.typepacks.telegram"
  ],
  "services": [
    "telegram"
  ]
}
