{
  "identifier": "run.vineyard.pluginpacks.domain_recon",
  "content_type": "vineyard:pluginpack",
  "name": "Domain Recon",
  "author": "VINEYARD",
  "description": "Enriches Domain nodes with DNS records (A, AAAA, CNAME, MX, NS, TXT, CAA), RDAP registration data, and Certificate Transparency subdomains from crt.sh and crt.name (desktop only).",
  "repo": "Vineyard-Intelligence/pluginpack-domain-recon",
  "ref": "2b99d879f36768e2fabfb74c53ba07a7240736fd",
  "path": "plugins/domain-recon.manifest.json",
  "version": "2.1.3",
  "platforms": [
    "desktop",
    "web"
  ],
  "scopes_summary": {
    "network": true,
    "graph_write": true,
    "secret_config": false
  },
  "plugin_count": 10,
  "icon": "globe",
  "desktop_only": "some",
  "typepacks": [
    "run.vineyard.typepacks.infrastructure"
  ]
}
