{
  "identifier": "run.vineyard.pluginpacks.pgp_lookup",
  "content_type": "vineyard:pluginpack",
  "name": "PGP Key Lookup",
  "author": "VINEYARD",
  "description": "Finds OpenPGP public keys on public key directories by email address or key fingerprint. Desktop only.",
  "repo": "Vineyard-Intelligence/pluginpack-pgp-lookup",
  "ref": "c849ab563653ea7300e60b63a50a024bdb7d7798",
  "path": "plugins/pgp-lookup.manifest.json",
  "version": "1.1.0",
  "platforms": [
    "desktop",
    "web"
  ],
  "scopes_summary": {
    "network": true,
    "graph_write": true,
    "secret_config": false
  },
  "plugin_count": 1,
  "icon": "key",
  "desktop_only": "all",
  "typepacks": [
    "run.vineyard.typepacks.identity"
  ]
}
