{
  "identifier": "run.vineyard.pluginpacks.virustotal_community",
  "content_type": "vineyard:pluginpack",
  "name": "VirusTotal Community",
  "author": "VINEYARD",
  "description": "VirusTotal v3 reports (IP, domain, URL, file) and pivots (passive DNS, subdomains), limited to what a free community API key can read. Needs the analyst's own VirusTotal API key; a community key allows 240 requests/hour and 500/day. Desktop only.",
  "repo": "Vineyard-Intelligence/pluginpack-virustotal-community",
  "ref": "9a81b90a0cf64dacdf909ef8b7a921f7b3115968",
  "path": "plugins/virustotal-community.manifest.json",
  "version": "1.5.0",
  "platforms": [
    "desktop",
    "web"
  ],
  "scopes_summary": {
    "network": true,
    "graph_write": true,
    "secret_config": true
  },
  "plugin_count": 6,
  "icon": "scan-eye",
  "desktop_only": "all",
  "typepacks": [
    "run.vineyard.typepacks.infrastructure",
    "run.vineyard.typepacks.threat"
  ]
}
