{
  "identifier": "run.vineyard.pluginpacks.ip_recon",
  "content_type": "vineyard:pluginpack",
  "name": "IP Recon",
  "author": "VINEYARD",
  "description": "Enriches IP Address nodes with RDAP allocation, Shodan InternetDB open ports/CVEs/hostnames/tags, and geolocation.",
  "repo": "Vineyard-Intelligence/pluginpack-ip-recon",
  "ref": "8f2d48f404729dddb12976a5542d2c340083c568",
  "path": "plugins/ip-recon.manifest.json",
  "version": "2.0.0",
  "platforms": [
    "web"
  ],
  "scopes_summary": {
    "network": true,
    "graph_write": true,
    "secret_config": false
  },
  "plugin_count": 3,
  "icon": "network",
  "typepacks": [
    "run.vineyard.typepacks.geo",
    "run.vineyard.typepacks.infrastructure",
    "run.vineyard.typepacks.threat"
  ]
}
