{
  "identifier": "run.vineyard.pluginpacks.web_recon",
  "content_type": "vineyard:pluginpack",
  "name": "Web Recon",
  "author": "VINEYARD",
  "description": "Fingerprints web pages: favicon hashes in the forms Shodan, Censys and other search services index, HHHash of the response header names, and a hash of the HTML tag structure. Desktop only.",
  "repo": "Vineyard-Intelligence/pluginpack-web-recon",
  "ref": "5c3d48cb5046a815969431621fade99dfd74bd05",
  "path": "plugins/web-recon.manifest.json",
  "version": "1.3.0",
  "platforms": [
    "desktop",
    "web"
  ],
  "scopes_summary": {
    "network": true,
    "graph_write": true,
    "secret_config": false
  },
  "plugin_count": 3,
  "icon": "fingerprint",
  "desktop_only": "all",
  "typepacks": [
    "run.vineyard.typepacks.infrastructure"
  ]
}
