{
  "identifier": "run.vineyard.pluginpacks.lazarusday",
  "content_type": "vineyard:pluginpack",
  "name": "lazarus.day",
  "author": "VINEYARD",
  "description": "Searches and reads lazarus.day (https://lazarus.day), the public DPRK indicator index by @lazarusholic (https://x.com/lazarusholic): keyword search stages matches as graph nodes, and exact-record lookup adds the reports naming them. Desktop only.",
  "repo": "Vineyard-Intelligence/pluginpack-lazarusday",
  "ref": "cfaa9ed694546776e6544d4c3ab934cf4a87184d",
  "path": "plugins/lazarusday.manifest.json",
  "version": "1.4.2",
  "platforms": [
    "desktop",
    "web"
  ],
  "scopes_summary": {
    "network": true,
    "graph_write": true,
    "secret_config": false
  },
  "plugin_count": 2,
  "icon": "radar",
  "desktop_only": "all",
  "typepacks": [
    "run.vineyard.typepacks.financial",
    "run.vineyard.typepacks.identity",
    "run.vineyard.typepacks.infrastructure",
    "run.vineyard.typepacks.threat"
  ],
  "thumbnail_url": "assets/thumbnail.png"
}
